{
  "$schema": "schema/baseline.schema.json",
  "external_inputs": {
    "libtpu": null,
    "tokamax": null,
    "tpu_target": null
  },
  "repository": {
    "inputs": {
      ".gitmodules": {
        "sha256": "4d7231829695cfc7dc8c2507a6931a2d1d71d558b21238d47ee1841670b62059",
        "size_bytes": 12311
      },
      ".python-version": {
        "sha256": "fa682ae9d943f5c8076e68335c9ba3ab4d063ad035c07ac6928653dd4ac50af7",
        "size_bytes": 7
      },
      "manifests/schema/baseline.schema.json": {
        "sha256": "f154b14314ae016b475b9ab79383e0b3b95fe6fad29b6fb3c6cf0ca482ea0106",
        "size_bytes": 10038
      },
      "pyproject.toml": {
        "sha256": "3ab69082648ed4b165e1b262b1c4d037c9121b21f4877f468d1ca446fd3fc4c2",
        "size_bytes": 481
      },
      "upstream-sources.lock": {
        "sha256": "66f96578a170de578fd6dd03e85979f321d4cb2f3e7c2d1be810ea6938f705ed",
        "size_bytes": 14340
      },
      "upstream/jax/.bazelversion": {
        "sha256": "2080871d1a0d5cc3d3a304acff946cb083f90a6cae0b8291fe399b1d4fd83369",
        "size_bytes": 6
      },
      "uv.lock": {
        "sha256": "3f66f573c5603aeeaa182175ae0e531d0672c70e616bc009fd9565a8a0deaa63",
        "size_bytes": 150179
      }
    },
    "root": {
      "git_commit": "7417c034a29015031fa7fc38f7ed663860a4f964",
      "path": ".",
      "verification": "ancestor"
    },
    "sources": {
      "jax": {
        "dirty": false,
        "git_commit": "2d66622450e2c8633cda2307688ef7aa294bd6eb",
        "path": "upstream/jax",
        "status": []
      },
      "llvm": {
        "dirty": false,
        "git_commit": "75a45c373407c13a44c7abb28a78d891a97fe665",
        "path": "upstream/llvm-project",
        "status": []
      },
      "shardy": {
        "dirty": false,
        "git_commit": "2832731619ffb4bcc718faa4aa8054214a68c969",
        "path": "upstream/shardy",
        "status": []
      },
      "stablehlo": {
        "dirty": false,
        "git_commit": "7b1b15781ccbd770f50c7eef4b0c3e03834649fd",
        "path": "upstream/stablehlo",
        "status": []
      },
      "xla": {
        "dirty": false,
        "git_commit": "dcf304bc5dca1932b99f740b911dbd73631a1a69",
        "path": "upstream/xla",
        "status": []
      }
    }
  },
  "runtime": {
    "device": {
      "arch": "x86_64",
      "default_platform": "cpu",
      "device_count": 1,
      "devices": [
        "cpu:0"
      ],
      "host_os": "Linux",
      "platforms": [
        "cpu"
      ]
    },
    "jax": {
      "imported_file": "upstream/jax/jax/__init__.py",
      "imported_file_sha256": "e97031df0826c1ed1399652872281209a5c8d1d64302da6cf8ce158c0bb51f66",
      "install_type": "editable-source",
      "reported_git_hash": null,
      "source_checkout_git_hash": "2d66622450e2c8633cda2307688ef7aa294bd6eb",
      "version": "0.11.1.dev20260818+2d66622450"
    },
    "jaxlib": {
      "build_revision": "2d66622450e2c8633cda2307688ef7aa294bd6eb",
      "distribution": {
        "artifact_sha256": "c3dcec3bb33ebf5c76dc33f962c796652c077edb246464fa32cb1d8fcb6087e6",
        "artifact_size_bytes": 87903454,
        "artifact_uri": "artifact:jaxlib-0.11.1-cp312-cp312-manylinux_2_27_x86_64.whl",
        "kind": "lock-artifact",
        "lock_path": "uv.lock",
        "retrieval": "Resolve this exact wheel entry from uv.lock with uv sync --locked."
      },
      "install_type": "installed-wheel",
      "native_binaries": [
        {
          "artifact_path": ".venv/lib/python3.12/site-packages/jaxlib/_hlo.so",
          "package_path": "_hlo.so",
          "sha256": "da3acce5cadff67c523d7a0bd37f9366f45456290bd5722c2d5c8ed82684fffa",
          "size_bytes": 3592
        },
        {
          "artifact_path": ".venv/lib/python3.12/site-packages/jaxlib/_ifrt_proxy.so",
          "package_path": "_ifrt_proxy.so",
          "sha256": "28863472384ef27b37623b25964e3d9b11ee73b4d7241c08fdbe03b16fce76ef",
          "size_bytes": 3616
        },
        {
          "artifact_path": ".venv/lib/python3.12/site-packages/jaxlib/_jax.so",
          "package_path": "_jax.so",
          "sha256": "6a28f034febe24e313cd12b45a97edeed3e226fa23383effa9d1fe7937beaa83",
          "size_bytes": 3576
        },
        {
          "artifact_path": ".venv/lib/python3.12/site-packages/jaxlib/_pretty_printer.so",
          "package_path": "_pretty_printer.so",
          "sha256": "c1719b8b1d9161618332ab097d809789c88d961318661c64c449275ddbc37334",
          "size_bytes": 3624
        },
        {
          "artifact_path": ".venv/lib/python3.12/site-packages/jaxlib/_profile_data.so",
          "package_path": "_profile_data.so",
          "sha256": "d8210921f95a5813d60ee81f169792e1b690e27a4a2e2d0bbab5176743dfb110",
          "size_bytes": 3632
        },
        {
          "artifact_path": ".venv/lib/python3.12/site-packages/jaxlib/_profiler.so",
          "package_path": "_profiler.so",
          "sha256": "623ee0144611d362a64bff482dce09716a5dd63a392616f73036c09d9930ef6e",
          "size_bytes": 3624
        },
        {
          "artifact_path": ".venv/lib/python3.12/site-packages/jaxlib/_xla.so",
          "package_path": "_xla.so",
          "sha256": "757add466e0718ac74b16bcf86c895af57a093e808197638bbe4f7b6ca3a8258",
          "size_bytes": 3576
        },
        {
          "artifact_path": ".venv/lib/python3.12/site-packages/jaxlib/cpu/_lapack.so",
          "package_path": "cpu/_lapack.so",
          "sha256": "44f1b1d739230b0c5e152c3625ce6515520a181ea22bd6632a3ee93e5aca7429",
          "size_bytes": 1887224
        },
        {
          "artifact_path": ".venv/lib/python3.12/site-packages/jaxlib/cpu/_sparse.so",
          "package_path": "cpu/_sparse.so",
          "sha256": "b6827a9cebc3ea9f5220b55d259f93396de4e3bfc25ca470e39477db90901917",
          "size_bytes": 246824
        },
        {
          "artifact_path": ".venv/lib/python3.12/site-packages/jaxlib/cpu_feature_guard.so",
          "package_path": "cpu_feature_guard.so",
          "sha256": "bd5828eeb31ac47ff7ed6be9bc11dfa15f9dc022726e793c952fe6e55ff841d3",
          "size_bytes": 4728
        },
        {
          "artifact_path": ".venv/lib/python3.12/site-packages/jaxlib/libjax_common.so",
          "package_path": "libjax_common.so",
          "sha256": "5e4a89f4c4f1b4928d97bcdc678174708ab14dc250744f9d92c1cf168af707b3",
          "size_bytes": 348918384
        },
        {
          "artifact_path": ".venv/lib/python3.12/site-packages/jaxlib/mlir/_mlir_libs/_chlo.so",
          "package_path": "mlir/_mlir_libs/_chlo.so",
          "sha256": "f8c589b5a7805c0057cdff3c3d1b6c1c78bd6cfac50b3ab03cf167ebda8cd1ba",
          "size_bytes": 3592
        },
        {
          "artifact_path": ".venv/lib/python3.12/site-packages/jaxlib/mlir/_mlir_libs/_jax_mlir_ext.so",
          "package_path": "mlir/_mlir_libs/_jax_mlir_ext.so",
          "sha256": "b70dbd3dc0994f69456cf3c47e04c37b05d9b3a139da4dfe24e1bacd4c00ed16",
          "size_bytes": 3632
        },
        {
          "artifact_path": ".venv/lib/python3.12/site-packages/jaxlib/mlir/_mlir_libs/_mlir.so",
          "package_path": "mlir/_mlir_libs/_mlir.so",
          "sha256": "ce30a6e5d49b2c694a1b82d31a41c5882036786cfadf484775e1f32941d06ff3",
          "size_bytes": 3592
        },
        {
          "artifact_path": ".venv/lib/python3.12/site-packages/jaxlib/mlir/_mlir_libs/_mosaic_gpu_ext.so",
          "package_path": "mlir/_mlir_libs/_mosaic_gpu_ext.so",
          "sha256": "1978360fbc410162d9309c75a6fc9a5a5deb5a0815525dd61b5bb3926b0883b5",
          "size_bytes": 3640
        },
        {
          "artifact_path": ".venv/lib/python3.12/site-packages/jaxlib/mlir/_mlir_libs/_sdy.so",
          "package_path": "mlir/_mlir_libs/_sdy.so",
          "sha256": "ae337e723b1b38ee7a4496952e991fe328db495fb9e1a5d7617fec3032d60ff4",
          "size_bytes": 3592
        },
        {
          "artifact_path": ".venv/lib/python3.12/site-packages/jaxlib/mlir/_mlir_libs/_sdyMpmd.so",
          "package_path": "mlir/_mlir_libs/_sdyMpmd.so",
          "sha256": "1671b82945d41143c22f2d62ad6c06b5ee92379102def2669a70769aabdd78a9",
          "size_bytes": 3608
        },
        {
          "artifact_path": ".venv/lib/python3.12/site-packages/jaxlib/mlir/_mlir_libs/_stablehlo.so",
          "package_path": "mlir/_mlir_libs/_stablehlo.so",
          "sha256": "4c3d2ca3bee280003a5e6f9321bd6d086157727ee796a57e6df1b344437324ba",
          "size_bytes": 3624
        },
        {
          "artifact_path": ".venv/lib/python3.12/site-packages/jaxlib/mlir/_mlir_libs/_tpu_ext.so",
          "package_path": "mlir/_mlir_libs/_tpu_ext.so",
          "sha256": "72433fb380a5effd0eb89aaf1b224277ac65729281cb1150265057fd9c429360",
          "size_bytes": 3608
        },
        {
          "artifact_path": ".venv/lib/python3.12/site-packages/jaxlib/utils.so",
          "package_path": "utils.so",
          "sha256": "2c8d8bea24fff23769f400447f117fb9007fb5dcf6a9b449d57965eb776e423a",
          "size_bytes": 3576
        },
        {
          "artifact_path": ".venv/lib/python3.12/site-packages/jaxlib/weakref_lru_cache.so",
          "package_path": "weakref_lru_cache.so",
          "sha256": "0b361ecfbab33a19eac100c9aafb9d6b50e3a57965f09062d1bf519e140bdf90",
          "size_bytes": 3632
        }
      ],
      "package_root": ".venv/lib/python3.12/site-packages/jaxlib",
      "version": "0.11.1"
    }
  },
  "schema_version": "1.0",
  "status": {
    "evidence_level": "RUN-CPU",
    "jax_source_matches_jaxlib_build": true,
    "qualifiers": [],
    "reason": "The imported editable JAX checkout and jaxlib build revision are aligned.",
    "runtime_source_alignment": "ALIGNED"
  },
  "toolchain": {
    "python": {
      "project_constraint": "==3.12.*",
      "repository_pin": "3.12.3",
      "runtime": "3.12.3"
    },
    "uv": {
      "artifact_sha256": "671793498fe0a545432e2524b6691ffb9eea4540d9fda43ca2f978df2dbf8426",
      "artifact_size_bytes": 49313824,